{
  "schema_version": 1,
  "locale": "ru",
  "heading": "Ваш набор Evidence Lab",
  "intro": "По вашим ответам я рекомендую следующий полный набор исследовательских возможностей:",
  "why_label": "Почему подходит",
  "details": "Количество возможностей: {count}. Приложение: {host}. Стабильная версия: {release}.",
  "pending": "Пока ничего не установлено.",
  "confirmation": "Добавить весь этот набор?",
  "hosts": {
    "codex": "Codex",
    "claude-code": "Claude Code"
  },
  "packs": [
    {"id": "evidence-lab-core", "title": "Основа исследовательской работы", "purpose": "Проверка источников, цитирование, критический разбор и воспроизводимая настройка Evidence Lab."},
    {"id": "document-evidence", "title": "PDF и документы", "purpose": "Преобразует поддерживаемые документы в проверяемый материал для анализа."},
    {"id": "literature-publication", "title": "Литература и публикация", "purpose": "Помогает синтезировать литературу, готовить научный текст, схемы и рецензию рукописи."},
    {"id": "research-design", "title": "Дизайн исследования", "purpose": "Помогает сформулировать проверяемые гипотезы и обоснованный план исследования или эксперимента."},
    {"id": "structured-data-analysis", "title": "Таблицы и наборы данных", "purpose": "Помогает воспроизводимо получать данные и проводить первичный анализ их качества."},
    {"id": "quantitative-sciences", "title": "Количественные методы", "purpose": "Добавляет статистику, расчёт мощности, работу с неопределённостью, единицами и научной визуализацией."},
    {"id": "life-sciences", "title": "Проверки для наук о жизни", "purpose": "Добавляет проверки протоколов, контролей, смещений, биобезопасности и качества отчётности."},
    {"id": "publication-monitoring", "title": "Мониторинг публикаций", "purpose": "Следит за новыми научными работами с устойчивыми запросами и устранением дублей."},
    {"id": "qualitative-research", "title": "Качественное исследование", "purpose": "Поддерживает прозрачное кодирование, работу с фрагментами, рефлексивные заметки и тематический синтез."},
    {"id": "research-images", "title": "Исследовательские изображения", "purpose": "Сохраняет связь изображения с источником, преобразованиями, измерениями и границами интерпретации."},
    {"id": "systematic-review", "title": "Систематический обзор", "purpose": "Поддерживает воспроизводимый поиск, скрининг, устранение дублей и решения о включении."},
    {"id": "data-and-pdf", "title": "Единый маршрут для документов и данных", "purpose": "Связывает работу с документами, таблицами и наборами данных в одном исследовательском процессе."},
    {"id": "full-research-cycle", "title": "Маршрут полного цикла", "purpose": "Связывает дизайн исследования с обзором литературы и подготовкой публикации."}
  ],
  "rules": [
    {"id": "required-foundation", "reason": "Каждому рабочему пространству Evidence Lab нужна общая доказательная основа."},
    {"id": "document-evidence-material", "reason": "Вы работаете с PDF или другими исследовательскими документами."},
    {"id": "literature-publication-workflow", "reason": "Ваша работа включает обзор литературы, подготовку публикации или рецензирование."},
    {"id": "literature-publication-writing", "reason": "Сейчас вы готовите научный текст."},
    {"id": "research-design-workflow", "reason": "Ваш маршрут включает гипотезы, планирование исследования или дизайн эксперимента."},
    {"id": "structured-data-material", "reason": "Вы работаете с таблицами или наборами данных."},
    {"id": "structured-data-collection", "reason": "Вам нужно собирать и сопоставлять структурированные данные."},
    {"id": "quantitative-method", "reason": "Вы используете статистику, код, формулы или математические модели."},
    {"id": "life-science-planning", "reason": "Вы планируете или активно ведёте исследование в науках о жизни."},
    {"id": "life-science-images", "reason": "В исследовании по наукам о жизни используются изображения."},
    {"id": "publication-monitoring-workflow", "reason": "Вы хотите следить за новыми научными публикациями."},
    {"id": "qualitative-material", "reason": "Вы работаете с интервью, опросами или качественными текстами."},
    {"id": "research-image-material", "reason": "Вам нужно анализировать или измерять исследовательские изображения."},
    {"id": "systematic-review-stage", "reason": "Вы проводите систематический обзор или мета-анализ."},
    {"id": "data-and-pdf-full-cycle-datasets", "reason": "В полном цикле вы сочетаете документы с наборами данных."},
    {"id": "data-and-pdf-full-cycle-tables", "reason": "В полном цикле вы сочетаете документы с таблицами."},
    {"id": "full-cycle-workflow", "reason": "Вы выбрали поддержку полного цикла исследования."}
  ]
}
