{
  "schema_version": 1,
  "locale": "en",
  "heading": "Your Evidence Lab setup",
  "intro": "Based on your answers, this is the complete set of research capabilities I recommend:",
  "why_label": "Why it fits",
  "details": "Number of capabilities: {count}. Application: {host}. Stable version: {release}.",
  "pending": "Nothing has been installed yet.",
  "confirmation": "Would you like me to add this complete setup?",
  "hosts": {
    "codex": "Codex",
    "claude-code": "Claude Code"
  },
  "packs": [
    {"id": "evidence-lab-core", "title": "Research foundation", "purpose": "Source checks, citations, critical review, and reproducible Evidence Lab setup."},
    {"id": "document-evidence", "title": "PDF and document evidence", "purpose": "Turns supported documents into inspectable material for analysis."},
    {"id": "literature-publication", "title": "Literature and publication", "purpose": "Supports literature synthesis, academic writing, diagrams, and manuscript review."},
    {"id": "research-design", "title": "Research design", "purpose": "Helps formulate testable hypotheses and defensible study or experiment designs."},
    {"id": "structured-data-analysis", "title": "Tables and datasets", "purpose": "Supports reproducible data retrieval and exploratory data-quality analysis."},
    {"id": "quantitative-sciences", "title": "Quantitative methods", "purpose": "Adds statistics, power analysis, uncertainty, units, and scientific visualization."},
    {"id": "life-sciences", "title": "Life-science checks", "purpose": "Adds protocol, control, bias, biosafety, and reporting checks for life-science work."},
    {"id": "publication-monitoring", "title": "Publication monitoring", "purpose": "Tracks new scholarly publications with stable queries and deduplicated updates."},
    {"id": "qualitative-research", "title": "Qualitative research", "purpose": "Supports traceable coding, excerpts, reflexive notes, and thematic synthesis."},
    {"id": "research-images", "title": "Research images", "purpose": "Keeps image identity, transformations, measurements, exclusions, and interpretation traceable."},
    {"id": "systematic-review", "title": "Systematic review", "purpose": "Supports reproducible searching, screening, deduplication, and inclusion decisions."},
    {"id": "data-and-pdf", "title": "Combined document-and-data route", "purpose": "Connects document evidence with table and dataset analysis in one research route."},
    {"id": "full-research-cycle", "title": "Complete research-cycle route", "purpose": "Connects research design with literature and publication work from start to finish."}
  ],
  "rules": [
    {"id": "required-foundation", "reason": "Every Evidence Lab workspace needs the shared evidence foundation."},
    {"id": "document-evidence-material", "reason": "You work with PDFs or other research documents."},
    {"id": "literature-publication-workflow", "reason": "Your work includes literature synthesis, publication writing, or manuscript review."},
    {"id": "literature-publication-writing", "reason": "You are currently preparing scholarly text."},
    {"id": "research-design-workflow", "reason": "Your route includes hypotheses, study planning, or experimental design."},
    {"id": "structured-data-material", "reason": "You work with tables or datasets."},
    {"id": "structured-data-collection", "reason": "Your route includes collecting and comparing structured data."},
    {"id": "quantitative-method", "reason": "You use statistics, code, formulas, or mathematical models."},
    {"id": "life-science-planning", "reason": "Your life-science work is at a planning or active-research stage."},
    {"id": "life-science-images", "reason": "Your life-science work includes research images."},
    {"id": "publication-monitoring-workflow", "reason": "You want to follow newly published research."},
    {"id": "qualitative-material", "reason": "You work with interviews, surveys, or qualitative text."},
    {"id": "research-image-material", "reason": "You need to inspect or measure research images."},
    {"id": "systematic-review-stage", "reason": "You are conducting a systematic review or meta-analysis."},
    {"id": "data-and-pdf-full-cycle-datasets", "reason": "Your full research cycle combines documents with datasets."},
    {"id": "data-and-pdf-full-cycle-tables", "reason": "Your full research cycle combines documents with tables."},
    {"id": "full-cycle-workflow", "reason": "You chose support for the complete research cycle."}
  ]
}
